name,url,id
"""Hey, at Least It Wasn't Your Leg"" Arm Sling by Sweet C",https://www.ravelry.com/patterns/library/hey-at-least-it-wasnt-your-leg-arm-sling,80882
"""Kitty"" Eye Patch by Christine H. Wilkins",https://www.ravelry.com/patterns/library/kitty-eye-patch-2,118789
Alternative ML Knitted Knockers by Makoshark,https://www.ravelry.com/patterns/library/alternative-ml-knitted-knockers,951015
Amon ammeinnlegg by Anne Tvedt,https://www.ravelry.com/patterns/library/amon-ammeinnlegg,807316
Amputee's Stump Covers by Suzetta Williams,https://www.ravelry.com/patterns/library/amputees-stump-covers,287776
Ankle Wrap Ice Packs by Rachel Sandler,https://www.ravelry.com/patterns/library/ankle-wrap-ice-packs,328142
Arm Cast Covers by Sweet Southern Stitches,https://www.ravelry.com/patterns/library/arm-cast-covers,551389
Arm Cast Sleeve by Steph Miller,https://www.ravelry.com/patterns/library/arm-cast-sleeve,991713
Arm Sling by Joan of Dark aka Toni Carr,https://www.ravelry.com/patterns/library/arm-sling,80981
Bandages for Leprosy Patients by Linda Stocker,https://www.ravelry.com/patterns/library/bandages-for-leprosy-patients,38588
Boo Boo Buddy by Jessica King,https://www.ravelry.com/patterns/library/boo-boo-buddy,305647
Boo-boo Buddies by Megan Kreiner,https://www.ravelry.com/patterns/library/boo-boo-buddies,570625
Boo-boo Buddies by Megan Kreiner,https://www.ravelry.com/patterns/library/boo-boo-buddies-2,579132
Boo-Boo Bunny Knit Pouch by Marly Bird,https://www.ravelry.com/patterns/library/boo-boo-bunny-knit-pouch,828005
Boob by Jamin Chenault,https://www.ravelry.com/patterns/library/boob,271934
BOOBOO Bunny by Malissa M.Bise,https://www.ravelry.com/patterns/library/booboo-bunny,735088
Breast Cancer Awareness Boobies by Melanie Grobler,https://www.ravelry.com/patterns/library/breast-cancer-awareness-boobies,865422
Breast Cancer Survivor's False Breast by Jessica Evans,https://www.ravelry.com/patterns/library/breast-cancer-survivors-false-breast,164435
Breast Forms by Lisa Rode,https://www.ravelry.com/patterns/library/breast-forms,865397
Breast Prosthetic Round by Scarlett Royal,https://www.ravelry.com/patterns/library/breast-prosthetic-round,1053583
Breastfeeding Puppet by Alison Dowler,https://www.ravelry.com/patterns/library/breastfeeding-puppet,1303464
Bust Buddies by Eileen Adler,https://www.ravelry.com/patterns/library/bust-buddies,825548
Cane Handle Cover by Red Arazi,https://www.ravelry.com/patterns/library/cane-handle-cover,1140872
Cast Toe Warmer by sa3p,https://www.ravelry.com/patterns/library/cast-toe-warmer,444034
Catheter Leg Bag Covers by Becky Tharp,https://www.ravelry.com/patterns/library/catheter-leg-bag-covers,930440
Centifolia Rose by Lesley Stanfield,https://www.ravelry.com/patterns/library/centifolia-rose,164793
Chemo Port Seatbelt Pad by Dawni Criswell,https://www.ravelry.com/patterns/library/chemo-port-seatbelt-pad,512546
Chill Buddy Ice Pack by Heidi Yates,https://www.ravelry.com/patterns/library/chill-buddy-ice-pack,1004598
Comfort Pack by Donna Hulka,https://www.ravelry.com/patterns/library/comfort-pack,21556
Comfort Rice Bag by Jeanne Steinhilber,https://www.ravelry.com/patterns/library/comfort-rice-bag,618700
Cotton Chenille Boob by Beryl Tsang,https://www.ravelry.com/patterns/library/cotton-chenille-boob,81579
Cotton pantie liner by Rachel Gough,https://www.ravelry.com/patterns/library/cotton-pantie-liner,253912
Crochet Boob by Paula Garrard,https://www.ravelry.com/patterns/library/crochet-boob-2,1058062
Crochet Breast by Denise Hayes,https://www.ravelry.com/patterns/library/crochet-breast-2,663244
Crochet Cannula Sleeve by Coral Bale,https://www.ravelry.com/patterns/library/crochet-cannula-sleeve,1010380
Crochet Fem Pad Core by Lexxy Vorpahl,https://www.ravelry.com/patterns/library/crochet-fem-pad-core,307230
Crochet Modesty Pouch for Medical Devices by Erin Peters,https://www.ravelry.com/patterns/library/crochet-modesty-pouch-for-medical-devices,973821
Crocheted Cast Sock by Terrilene Luxon,https://www.ravelry.com/patterns/library/crocheted-cast-sock,805216
Crocheted Knocker by Merrifield Gardens,https://www.ravelry.com/patterns/library/crocheted-knocker,758641
crocheted menstrual cup by Kade Bagnall-Oakeley,https://www.ravelry.com/patterns/library/crocheted-menstrual-cup,1170491
Crocheted Midwifery Scale Sling by Chalyn Myers,https://www.ravelry.com/patterns/library/crocheted-midwifery-scale-sling,811066
Crutch Clutch by Karen Weiner,https://www.ravelry.com/patterns/library/crutch-clutch,267608
Crutch Covers by jellybean78,https://www.ravelry.com/patterns/library/crutch-covers,527313
Crutches Cover by Jocelyn Ng,https://www.ravelry.com/patterns/library/crutches-cover,1235940
Crutches Cozy by Stitch Neutral,https://www.ravelry.com/patterns/library/crutches-cozy,225858
Daisy Cord Tie by Sandy Jones,https://www.ravelry.com/patterns/library/daisy-cord-tie,1250985
Deadpool PICC Line Cuff by Julie Laffoon,https://www.ravelry.com/patterns/library/deadpool-picc-line-cuff,674335
Deflowered by Brittany Wilson,https://www.ravelry.com/patterns/library/deflowered,117181
Dialysis Catheter Sleeve by Summer Brunton-Elliott,https://www.ravelry.com/patterns/library/dialysis-catheter-sleeve,839065
Dialysis Fistula/Graft Cover by Afton Mercer,https://www.ravelry.com/patterns/library/dialysis-fistula-graft-cover,761984
Dialysis sleeve by Annie Lilley,https://www.ravelry.com/patterns/library/dialysis-sleeve,1279220
Double Ties Port Pillow by Melanie Shovelski,https://www.ravelry.com/patterns/library/double-ties-port-pillow,1158338
Easy knitted stoma bib by Web Whispers,https://www.ravelry.com/patterns/library/easy-knitted-stoma-bib,512210
Eco-Friendly Tampon by Danielle Graf,https://www.ravelry.com/patterns/library/eco-friendly-tampon,130072
Eye bandage No. 1 by Elsa Barsaloux,https://www.ravelry.com/patterns/library/eye-bandage-no-1,554713
Eye bandage No. 2 by Elsa Barsaloux,https://www.ravelry.com/patterns/library/eye-bandage-no-2,537899
Face Punch Relaxation Mask by Lindsey of Apocaknits,https://www.ravelry.com/patterns/library/face-punch-relaxation-mask,65235
Faux Boob by Cris Porter,https://www.ravelry.com/patterns/library/faux-boob,290622
Feminine pad by Kirsten Dembicki,https://www.ravelry.com/patterns/library/feminine-pad-2,749589
Fixation PICC Line Cover by Shannon Dunbabin,https://www.ravelry.com/patterns/library/fixation-picc-line-cover,933185
Folded PICC Sleeve by Elizabeth F. Stabler,https://www.ravelry.com/patterns/library/folded-picc-sleeve,515430
Foot Cast Covers by Sandy Nordwall Eggers,https://www.ravelry.com/patterns/library/foot-cast-covers,1216026
Football Cast Sock by Terrilene Luxon,https://www.ravelry.com/patterns/library/football-cast-sock,805263
Gebreide Borstprothese by Claudia Barbo,https://www.ravelry.com/patterns/library/gebreide-borstprothese,727756
Gefilte Fish - Well Tempered Fish by Sandra Ronca,https://www.ravelry.com/patterns/library/gefilte-fish---well-tempered-fish,758698
Hand Warming bag by Dawn Milleson,https://www.ravelry.com/patterns/library/hand-warming-bag,181693
Heart Heating Pad / Comfort Pack by All That Crochet,https://www.ravelry.com/patterns/library/heart-heating-pad---comfort-pack,773526
Heat Pack Cover by Sandra Åhlberg,https://www.ravelry.com/patterns/library/heat-pack-cover,233188
heat pack by Mariel Redwood,https://www.ravelry.com/patterns/library/heat-pack,228538
Herbal Neck Wrap by Geane Helfrich,https://www.ravelry.com/patterns/library/herbal-neck-wrap,557409
"Home Made ""ACE"" Bandages by Jamie @ The Prepared Homemaker",https://www.ravelry.com/patterns/library/home-made-ace-bandages,425894
Hot Pack by Vicki Plunkett,https://www.ravelry.com/patterns/library/hot-pack,241238
Hot/Cold microwavable bag by Isabelle Simard,https://www.ravelry.com/patterns/library/hot-cold-microwavable-bag,316036
Ice Pack Covers by Eileen Troemel,https://www.ravelry.com/patterns/library/ice-pack-covers,891245
Ice Pack Cozy by Sara Lee,https://www.ravelry.com/patterns/library/ice-pack-cozy,45660
Ice Pack Pillowcase by Cris Porter,https://www.ravelry.com/patterns/library/ice-pack-pillowcase,384775
Ice Pack Socks by Denise Sutherland,https://www.ravelry.com/patterns/library/ice-pack-socks,417377
Ice/Hot Pak Pouches by Regina P Designs,https://www.ravelry.com/patterns/library/ice-hot-pak-pouches,1139153
Knitted Breast by Carolyn Westcott,https://www.ravelry.com/patterns/library/knitted-breast,2510
Knitted Heat/Ice Pack by Sara Carroll,https://www.ravelry.com/patterns/library/knitted-heat-ice-pack,219480
Knitted Ice Pack Cozy by Ampy Versalles-Curtis,https://www.ravelry.com/patterns/library/knitted-ice-pack-cozy,277881
Knitted Knockers - Flat On Two Needles by Terry Neal,https://www.ravelry.com/patterns/library/knitted-knockers---flat-on-two-needles,383256
Knitted Knockers Double pointed needles by KnittedKnockers.org,https://www.ravelry.com/patterns/library/knitted-knockers-double-pointed-needles,503114
Knitted Knockers DPNs In Round by Terry Neal,https://www.ravelry.com/patterns/library/knitted-knockers-dpns-in-round,320014
Knitted Knockers in the Round by Melissa Friedlund,https://www.ravelry.com/patterns/library/knitted-knockers-in-the-round,414495
Knitted Knockers on DPNs by Knitted Knockers,https://www.ravelry.com/patterns/library/knitted-knockers-on-dpns,1176417
Knitted Knockers-2 Needles by Claudia Barbo and Jennifer Taylor,https://www.ravelry.com/patterns/library/knitted-knockers-2-needles,644622
Knitted Knockers-Crochet by Terry Neal,https://www.ravelry.com/patterns/library/knitted-knockers-crochet,320017
Knitted Mex Tit Bit by Sharon Lloyd,https://www.ravelry.com/patterns/library/knitted-mex-tit-bit,399082
Knitted Port Pillow by Charlotte Yarn,https://www.ravelry.com/patterns/library/knitted-port-pillow,961916
Knitted Rice Bags by Kimberly Kwon,https://www.ravelry.com/patterns/library/knitted-rice-bags,143790
Knitted San Pad by Kelly Jo Sweeney,https://www.ravelry.com/patterns/library/knitted-san-pad,198331
Knitty Titty by Linda Hart,https://www.ravelry.com/patterns/library/knitty-titty,824436
Knockers (Crochet) by Claudia Barbo,https://www.ravelry.com/patterns/library/knockers-crochet,638630
Knotty Knockers by Shaz,https://www.ravelry.com/patterns/library/knotty-knockers,1279258
Knytbinda by Mirjam Gille,https://www.ravelry.com/patterns/library/knytbinda,759041
Laryngectomy Covers (Stoma Covers) by Web Whispers,https://www.ravelry.com/patterns/library/laryngectomy-covers-stoma-covers,512206
Leper Bandage A-378 by Coats & Clark,https://www.ravelry.com/patterns/library/leper-bandage-a-378,120045
Loom Knitted Knockers by Scarlett Royal,https://www.ravelry.com/patterns/library/loom-knitted-knockers,611824
Lucky St. Patrick's Shamrock - Home Remedy Toy by Sandra Ronca,https://www.ravelry.com/patterns/library/lucky-st-patricks-shamrock---home-remedy-toy,565090
Menstrual cup pouch by Anna Sjösvärd,https://www.ravelry.com/patterns/library/menstrual-cup-pouch-2,888194
Menstrual Pads by Irene Birk,https://www.ravelry.com/patterns/library/menstrual-pads,242367
Micropipette by Hatice Nur Aydın,https://www.ravelry.com/patterns/library/micropipette,1282874
Midwifery Baby Scale Sling by Rachel Ginsburg,https://www.ravelry.com/patterns/library/midwifery-baby-scale-sling,226822
Midwifery Boobs by Rebeckah Ferger,https://www.ravelry.com/patterns/library/midwifery-boobs,1186450
Miss March's Knitted Bandages by Joanna Johnson,https://www.ravelry.com/patterns/library/miss-marchs-knitted-bandages,309779
Mommy's Lifesaver Arm/Cast cozy by Sandra Jäger,https://www.ravelry.com/patterns/library/mommys-lifesaver-arm-cast-cozy,521956
Monster Hot/Cold Pack by Jennifer Spears,https://www.ravelry.com/patterns/library/monster-hot-cold-pack,188050
Mr. Chilly Cold Pack Cozy by Melissa Haferkamp,https://www.ravelry.com/patterns/library/mr-chilly-cold-pack-cozy,335675
MTF Breast Forms by Sid D,https://www.ravelry.com/patterns/library/mtf-breast-forms,1233064
My Cane Didn't Want to Be Naked Anymore by C.C. Almon,https://www.ravelry.com/patterns/library/my-cane-didnt-want-to-be-naked-anymore,332273
Neck Cozy by Bev Galeskas,https://www.ravelry.com/patterns/library/neck-cozy,20032
No-Sew Heat Packs by Margaret Hericz,https://www.ravelry.com/patterns/library/no-sew-heat-packs,973548
Nursing Mama Pads by Kimberly Poole,https://www.ravelry.com/patterns/library/nursing-mama-pads,337523
Oh So Merry French Press Cozy by Pam Carr,https://www.ravelry.com/patterns/library/oh-so-merry-french-press-cozy,1256118
PibCo by Silke R,https://www.ravelry.com/patterns/library/pibco,886240
Picc Arm Band by MellyBean,https://www.ravelry.com/patterns/library/picc-arm-band-2,414936
PICC Crochet Armband by Stacey Winklepleck,https://www.ravelry.com/patterns/library/picc-crochet-armband,587206
PICC Line Cover by Yolanda Sheehan,https://www.ravelry.com/patterns/library/picc-line-cover-2,570153
Pliable Ice Pack by Becky Kibblewhite,https://www.ravelry.com/patterns/library/pliable-ice-pack,418892
Poppy Cord Tie by Sandy Jones,https://www.ravelry.com/patterns/library/poppy-cord-tie,1251343
Port Cozy by Vicki Gentry,https://www.ravelry.com/patterns/library/port-cozy,805427
Port Protector by Sarah R,https://www.ravelry.com/patterns/library/port-protector,1074184
preemie cannula mitt by Sammy Bristow,https://www.ravelry.com/patterns/library/preemie-cannula-mitt,1035384
prótesis mamaria by Laura Cuñarro,https://www.ravelry.com/patterns/library/protesis-mamaria,1131897
Rainbow Crochet Cord Tie by Sandy Jones,https://www.ravelry.com/patterns/library/rainbow-crochet-cord-tie,1226142
Red Heart Cares Crochet First Aid Kit by Nancy Anderson,https://www.ravelry.com/patterns/library/red-heart-cares-crochet-first-aid-kit,637017
Red Heart Cares Knit First Aid Kit by Nancy Anderson,https://www.ravelry.com/patterns/library/red-heart-cares-knit-first-aid-kit,637016
Renal sleeve by Wisconsin kidney foundation,https://www.ravelry.com/patterns/library/renal-sleeve,236679
Residual Limb Covers for Amputees by Barbara Coley,https://www.ravelry.com/patterns/library/residual-limb-covers-for-amputees,162189
Reusable tampon by cherade9,https://www.ravelry.com/patterns/library/reusable-tampon,20516
Reusable Tampons by Kiera-Oona,https://www.ravelry.com/patterns/library/reusable-tampons,232292
Rice Log Cover by Bonnie Moore,https://www.ravelry.com/patterns/library/rice-log-cover,23926
Rice Neckrest Warmer Cover by Lynn Johanna,https://www.ravelry.com/patterns/library/rice-neckrest-warmer-cover,314545
Round Ice Bag by Lara Neel,https://www.ravelry.com/patterns/library/round-ice-bag,221705
Sanitary napkin by Tori Seierstad,https://www.ravelry.com/patterns/library/sanitary-napkin,719763
Shamrock Cord Tie by Sandy Jones,https://www.ravelry.com/patterns/library/shamrock-cord-tie,1234311
Snazzy Crutch Covers by Nicole Peters,https://www.ravelry.com/patterns/library/snazzy-crutch-covers,1006307
Sock Monkey Cast Sock by Terrilene Luxon,https://www.ravelry.com/patterns/library/sock-monkey-cast-sock,805230
Softies by Eileen Adler,https://www.ravelry.com/patterns/library/softies,689517
Soothing Aromatherapy Back Wrap by Darla Sims,https://www.ravelry.com/patterns/library/soothing-aromatherapy-back-wrap,116463
Spiderman Cast Covers by Tasha Margette,https://www.ravelry.com/patterns/library/spiderman-cast-covers,921850
Strawberry Cord Tie by Sandy Jones,https://www.ravelry.com/patterns/library/strawberry-cord-tie,1251348
Strawberry Menstrual Cup Pouch by Crystal Oldfield,https://www.ravelry.com/patterns/library/strawberry-menstrual-cup-pouch,125571
Strawberry menstrual cup pouch by Asia Kadłubowska,https://www.ravelry.com/patterns/library/strawberry-menstrual-cup-pouch-2,733767
Stump Cover by Shadow Byrd,https://www.ravelry.com/patterns/library/stump-cover,377337
Swift FX Strap Cover by Tera Johnson,https://www.ravelry.com/patterns/library/swift-fx-strap-cover,460143
Tit Bits by Beryl Tsang,https://www.ravelry.com/patterns/library/tit-bits,2302
Toasty Teddies - Heat Pack by FancifulFlights by Tracy Laliberté,https://www.ravelry.com/patterns/library/toasty-teddies---heat-pack,291014
Toddler's Cast Cover II by Hattie B. Holtapp,https://www.ravelry.com/patterns/library/toddlers-cast-cover-ii,84034
Toddler's Cast Cover by Hattie B. Holtapp,https://www.ravelry.com/patterns/library/toddlers-cast-cover,83276
Toe Cozy Cast Cover by Allison Dove,https://www.ravelry.com/patterns/library/toe-cozy-cast-cover,298744
Toe Sockies for Casts by Kim Brody Salazar,https://www.ravelry.com/patterns/library/toe-sockies-for-casts,578265
Travel Breast Hammock by Hazel Furst,https://www.ravelry.com/patterns/library/travel-breast-hammock,525550
Uprooted by Brittany Wilson,https://www.ravelry.com/patterns/library/uprooted,117182
Waffled Wheat Cushion by Gemma Pickford-Waugh,https://www.ravelry.com/patterns/library/waffled-wheat-cushion,288390
Well Tempered Baseball by Sandra Ronca,https://www.ravelry.com/patterns/library/well-tempered-baseball,578140
Well Tempered Cupcake by Sandra Ronca,https://www.ravelry.com/patterns/library/well-tempered-cupcake,704977
Well Tempered Flower by Sandra Ronca,https://www.ravelry.com/patterns/library/well-tempered-flower,567612
Well Tempered Football by Sandra Ronca,https://www.ravelry.com/patterns/library/well-tempered-football,578145
Well Tempered Heart by Sandra Ronca,https://www.ravelry.com/patterns/library/well-tempered-heart,575893
Well Tempered Ladybug by Sandra Ronca,https://www.ravelry.com/patterns/library/well-tempered-ladybug,567119
Well Tempered Turtle by Sandra Ronca,https://www.ravelry.com/patterns/library/well-tempered-turtle,567129
Wool Respirator by Clara Leach,https://www.ravelry.com/patterns/library/wool-respirator,962581
Woollen Knit Nursing Pads by Maxine Alexander,https://www.ravelry.com/patterns/library/woollen-knit-nursing-pads,35809
Woolly Boob by Kathryn Cottam,https://www.ravelry.com/patterns/library/woolly-boob,639320
Worry Bear by Joanne Seiff,https://www.ravelry.com/patterns/library/worry-bear,908676
Wrapped in Lace PICC Line Cover by Kirsten Holloway,https://www.ravelry.com/patterns/library/wrapped-in-lace-picc-line-cover,749754
Wrist rest by Lynne Rowe,https://www.ravelry.com/patterns/library/wrist-rest,464528
Yiho by Rebecca Sköld,https://www.ravelry.com/patterns/library/yiho,1289914
